{
  "schema_version": "fabricctl.bundle-verification-report/v1",
  "scope": "offline",
  "status": "pass",
  "readiness": "unverified",
  "operation": {"network": false, "mutating": false},
  "bundle_digest": "sha256:1111111111111111111111111111111111111111111111111111111111111111",
  "checks": [{"id": "bundle.integrity", "status": "pass"}],
  "diagnostics": []
}
